{
  "id": "http://json-schema.org/draft-04/schema#",
  "$schema": "http://json-schema.org/draft-04/schema#",
  "description": "Core schema meta-schema",
  "definitions": {
    "schemaArray": {
      "type": "array",
      "minItems": 1,
      "items": {
        "$ref": "#"
      }
    },
    "positiveInteger": {
      "type": "integer",
      "minimum": 0
    },
    "positiveIntegerDefault0": {
      "allOf": [
        {
          "$ref": "#/definitions/positiveInteger"
        },
        {
          "default": 0
        }
      ]
    },
    "simpleTypes": {
      "enum": [
        "array",
        "boolean",
        "integer",
        "null",
        "number",
        "object",
        "string"
      ]
    },
    "stringArray": {
      "type": "array",
      "items": {
        "type": "string"
      },
      "minItems": 1,
      "uniqueItems": true
    }
  },
  "type": "object",
  "properties": {
    "id": {
      "type": "string"
    },
    "$schema": {
      "type": "string"
    },
    "title": {
      "type": "string"
    },
    "description": {
      "type": "string"
    },
    "default": {},
    "multipleOf": {
      "type": "number",
      "minimum": 0,
      "exclusiveMinimum": true
    },
    "maximum": {
      "type": "number"
    },
    "exclusiveMaximum": {
      "type": "boolean",
      "default": false
    },
    "minimum": {
      "type": "number"
    },
    "exclusiveMinimum": {
      "type": "boolean",
      "default": false
    },
    "maxLength": {
      "$ref": "#/definitions/positiveInteger"
    },
    "minLength": {
      "$ref": "#/definitions/positiveIntegerDefault0"
    },
    "pattern": {
      "type": "string",
      "format": "regex"
    },
    "additionalItems": {
      "anyOf": [
        {
          "type": "boolean"
        },
        {
          "$ref": "#"
        }
      ],
      "default": {}
    },
    "items": {
      "anyOf": [
        {
          "$ref": "#"
        },
        {
          "$ref": "#/definitions/schemaArray"
        }
      ],
      "default": {}
    },
    "maxItems": {
      "$ref": "#/definitions/positiveInteger"
    },
    "minItems": {
      "$ref": "#/definitions/positiveIntegerDefault0"
    },
    "uniqueItems": {
      "type": "boolean",
      "default": false
    },
    "maxProperties": {
      "$ref": "#/definitions/positiveInteger"
    },
    "minProperties": {
      "$ref": "#/definitions/positiveIntegerDefault0"
    },
    "required": {
      "$ref": "#/definitions/stringArray"
    },
    "additionalProperties": {
      "anyOf": [
        {
          "type": "boolean"
        },
        {
          "$ref": "#"
        }
      ],
      "default": {}
    },
    "definitions": {
      "type": "object",
      "additionalProperties": {
        "$ref": "#"
      },
      "default": {}
    },
    "properties": {
      "type": "object",
      "additionalProperties": {
        "$ref": "#"
      },
      "default": {}
    },
    "patternProperties": {
      "type": "object",
      "additionalProperties": {
        "$ref": "#"
      },
      "default": {}
    },
    "dependencies": {
      "type": "object",
      "additionalProperties": {
        "anyOf": [
          {
            "$ref": "#"
          },
          {
            "$ref": "#/definitions/stringArray"
          }
        ]
      }
    },
    "enum": {
      "type": "array",
      "minItems": 1,
      "uniqueItems": true
    },
    "type": {
      "anyOf": [
        {
          "$ref": "#/definitions/simpleTypes"
        },
        {
          "type": "array",
          "items": {
            "$ref": "#/definitions/simpleTypes"
          },
          "minItems": 1,
          "uniqueItems": true
        }
      ]
    },
    "format": {
      "type": "string"
    },
    "allOf": {
      "$ref": "#/definitions/schemaArray"
    },
    "anyOf": {
      "$ref": "#/definitions/schemaArray"
    },
    "oneOf": {
      "$ref": "#/definitions/schemaArray"
    },
    "not": {
      "$ref": "#"
    },
    "$ref": {
      "title": "URI Reference",
      "description": "A reference to a statically identified schema.  This keyword must be set to an absolute URI or a relative reference as defined by [RFC 3986](https://www.rfc-editor.org/info/rfc3986), where its fragment (if any) can consist of a JSON Pointer as defined by [RFC 6901](https://datatracker.ietf.org/doc/html/rfc6901).",
      "type": "string"
    },
    "omitWhenMerged": {
      "title": "Omit when merged",
      "description": "Whether the field must be discarded during merging.",
      "type": "boolean",
      "default": false
    },
    "deprecated": {
      "title": "Deprecated",
      "description": "Information about the deprecation of this field.",
      "type": "object",
      "additionalProperties": false,
      "required": [
        "deprecatedVersion",
        "description"
      ],
      "properties": {
        "deprecatedVersion": {
          "title": "Deprecated version",
          "description": "The OCDS version in which this field was first deprecated.",
          "type": "string"
        },
        "description": {
          "title": "Description",
          "description": "A description of the reason for this field's deprecation.",
          "type": "string"
        }
      }
    },
    "codelist": {
      "title": "Codelist",
      "description": "The CSV file that defines the codes in the codelist that this field refers to.",
      "type": "string"
    },
    "openCodelist": {
      "title": "Open codelist",
      "description": "Whether the codelist that this field refers to is an open codelist.",
      "type": "boolean",
      "default": false
    },
    "wholeListMerge": {
      "title": "Whole list merge",
      "description": "Whether the field's value must be treated as a literal when merging.",
      "type": "boolean",
      "default": false
    }
  },
  "dependencies": {
    "exclusiveMaximum": [
      "maximum"
    ],
    "exclusiveMinimum": [
      "minimum"
    ]
  },
  "default": {},
  "additionalProperties": false
}
